<?xml version="1.0" encoding="UTF-8"?>
<paper xmlns="http://www.ftn.uns.ac.rs/publishing/paper"
    xmlns:xsi="http://www.w3.org/2001/XMLSchema-instance"
    xsi:schemaLocation="http://www.ftn.uns.ac.rs/publishing/paper Paper.xsd"
    xmlns:paper="http://www.ftn.uns.ac.rs/publishing/paper" id="1">
    <title>Some long paper title</title>
    <authors>
        <author>
            <name>Katarina Tukelic</name>
            <affiliation>Fakultet tehnickih nauka</affiliation>
        </author>
    </authors>
    <abstract>
        <content>Minimal character count for abstract is 10</content>
        <keywords></keywords>
    </abstract>
    <section>
        <heading>First section heading</heading>
        <content>
            Content can also be an image <image link="www.kaca.com"/>
            After image you can continue with writing whatever you want. 
            You can also put another picture:
            <image link="www.drugaslika.com"/> 
            You can also put a reference to literature down below:
            <reference paper:referenceId="1"></reference>
            You can add section in this section, but it most be after content
        </content>
        <section>
            <heading>Second smaller section with smaller heading</heading>
            <content></content>
        </section>
    </section>
    <references>
        <reference paper:referenceId="1" paper:crossReferenceId="someOtherPaperId">Some book title and some other stuff</reference>
    </references>
</paper>